{
  "key": "pilot-adept",
  "name": "Pilot Adept",
  "sourceKey": "sotg",
  "contentSet": "core",
  "prerequisites": [
    {
      "kind": "deploymentRank",
      "text": "Rank 2",
      "rank": 2
    }
  ],
  "description": "You have pilot training that allows you to perform special combat tactics. You learn two tactics of your choice from among those available to the Pilot deployment.\n\\columnbreak"
}
